{"analyzed_at":1791709470,"band":"high_concentration","band_reasons":["clusters_share_weighted"],"clusters":[{"cluster_id":"c-aac17950ab421f5d","confidence":0.7824,"evidence":[{"source":["12AS9Fxo9dkG4iQn8qwfpL7r5bhQh1yP6iktkoPySBoe","25kw7Zo6rgcaqHXBiRGzGZBjWiAPyuGJK2heN1nTAiqG","2xTGcDRUzx81pZqNoAmNC2WMhEYXWSkypDZMdcrV12tn","5C3vaYYmT4gtTZCcgWeDjzLbdUKbDo8caF7KpTVvERpX","5esoDZ7hPnEC3u7ggqGHoSEnz1yDAqJpjDPYNrvqFFuv","9Lv3ZCdyG117PbthiPPqUeUHbr2pLbwADiNPL7RCYg1H","A3FjbyRT3R6zSnBGNQtvMLyRjErckCXNZVC4Gjt14dfy","AJwPBfJUdrdZbwGYnxxeRV29oqaU3ixCdg4jj2u9MYfW","CCi7v34jAS82XXPSjQPqhZFUCWDWs4TogSRsyHDx79Mj","DgByrTdhvEtwEqU3NitSy1GwRh9WnspZUC3j9BRW7Zfb","E4ZndbesBKgUpXeFSWhj2MtrVhEhzPm4ChXvgKnmV4b3","J9cDUt9zQXHSX7bCzsrP9KyAwjaMGXEfRTJKG7czDGDH"],"type":"same_amounts","window":{"basis":"slot","end":318969052,"start":318937074}},{"source":["12AS9Fxo9dkG4iQn8qwfpL7r5bhQh1yP6iktkoPySBoe","25kw7Zo6rgcaqHXBiRGzGZBjWiAPyuGJK2heN1nTAiqG","2xTGcDRUzx81pZqNoAmNC2WMhEYXWSkypDZMdcrV12tn","5esoDZ7hPnEC3u7ggqGHoSEnz1yDAqJpjDPYNrvqFFuv","9Lv3ZCdyG117PbthiPPqUeUHbr2pLbwADiNPL7RCYg1H","CCi7v34jAS82XXPSjQPqhZFUCWDWs4TogSRsyHDx79Mj","DgByrTdhvEtwEqU3NitSy1GwRh9WnspZUC3j9BRW7Zfb","E4ZndbesBKgUpXeFSWhj2MtrVhEhzPm4ChXvgKnmV4b3","J9cDUt9zQXHSX7bCzsrP9KyAwjaMGXEfRTJKG7czDGDH"],"type":"same_amounts","window":{"basis":"slot","end":318971942,"start":318971942}},{"source":["12AS9Fxo9dkG4iQn8qwfpL7r5bhQh1yP6iktkoPySBoe","25kw7Zo6rgcaqHXBiRGzGZBjWiAPyuGJK2heN1nTAiqG","2xTGcDRUzx81pZqNoAmNC2WMhEYXWSkypDZMdcrV12tn","5C3vaYYmT4gtTZCcgWeDjzLbdUKbDo8caF7KpTVvERpX","5esoDZ7hPnEC3u7ggqGHoSEnz1yDAqJpjDPYNrvqFFuv","9Lv3ZCdyG117PbthiPPqUeUHbr2pLbwADiNPL7RCYg1H","A3FjbyRT3R6zSnBGNQtvMLyRjErckCXNZVC4Gjt14dfy","AJwPBfJUdrdZbwGYnxxeRV29oqaU3ixCdg4jj2u9MYfW","CCi7v34jAS82XXPSjQPqhZFUCWDWs4TogSRsyHDx79Mj","DgByrTdhvEtwEqU3NitSy1GwRh9WnspZUC3j9BRW7Zfb","E4ZndbesBKgUpXeFSWhj2MtrVhEhzPm4ChXvgKnmV4b3","J9cDUt9zQXHSX7bCzsrP9KyAwjaMGXEfRTJKG7czDGDH"],"type":"same_slot","window":{"basis":"slot","end":318971942,"start":318971942}},{"source":["12AS9Fxo9dkG4iQn8qwfpL7r5bhQh1yP6iktkoPySBoe","25kw7Zo6rgcaqHXBiRGzGZBjWiAPyuGJK2heN1nTAiqG","2xTGcDRUzx81pZqNoAmNC2WMhEYXWSkypDZMdcrV12tn","5C3vaYYmT4gtTZCcgWeDjzLbdUKbDo8caF7KpTVvERpX","5esoDZ7hPnEC3u7ggqGHoSEnz1yDAqJpjDPYNrvqFFuv","7VQXHJjFkfHJqPXoHWs9p41i1uSctkfhv4nR6vTb7cfU","9Lv3ZCdyG117PbthiPPqUeUHbr2pLbwADiNPL7RCYg1H","A3FjbyRT3R6zSnBGNQtvMLyRjErckCXNZVC4Gjt14dfy","AJwPBfJUdrdZbwGYnxxeRV29oqaU3ixCdg4jj2u9MYfW","CCi7v34jAS82XXPSjQPqhZFUCWDWs4TogSRsyHDx79Mj","DgByrTdhvEtwEqU3NitSy1GwRh9WnspZUC3j9BRW7Zfb","E4ZndbesBKgUpXeFSWhj2MtrVhEhzPm4ChXvgKnmV4b3","J9cDUt9zQXHSX7bCzsrP9KyAwjaMGXEfRTJKG7czDGDH"],"type":"shared_funder","window":{"basis":"block_time","end":1738877748,"start":1738877748}}],"supply_share":0.5599,"supply_share_denominator":"analyzed_buyers_received_amount","wallets":["12AS9Fxo9dkG4iQn8qwfpL7r5bhQh1yP6iktkoPySBoe","25kw7Zo6rgcaqHXBiRGzGZBjWiAPyuGJK2heN1nTAiqG","2xTGcDRUzx81pZqNoAmNC2WMhEYXWSkypDZMdcrV12tn","5C3vaYYmT4gtTZCcgWeDjzLbdUKbDo8caF7KpTVvERpX","CCi7v34jAS82XXPSjQPqhZFUCWDWs4TogSRsyHDx79Mj","5esoDZ7hPnEC3u7ggqGHoSEnz1yDAqJpjDPYNrvqFFuv","9Lv3ZCdyG117PbthiPPqUeUHbr2pLbwADiNPL7RCYg1H","A3FjbyRT3R6zSnBGNQtvMLyRjErckCXNZVC4Gjt14dfy","AJwPBfJUdrdZbwGYnxxeRV29oqaU3ixCdg4jj2u9MYfW","DgByrTdhvEtwEqU3NitSy1GwRh9WnspZUC3j9BRW7Zfb","E4ZndbesBKgUpXeFSWhj2MtrVhEhzPm4ChXvgKnmV4b3","J9cDUt9zQXHSX7bCzsrP9KyAwjaMGXEfRTJKG7czDGDH"]},{"cluster_id":"c-fb2ab5340168fed0","confidence":0.68,"evidence":[{"source":["2rKnVjD73CZXxhzVCiBd5a6UNTyLtFe16h8SRM5BU9hD","FZXibGDEYcbFebKcUNkn2JmhUP7DuNMnNgrECLC9QFfN"],"type":"same_amounts","window":{"basis":"slot","end":318969052,"start":318962202}},{"source":["2rKnVjD73CZXxhzVCiBd5a6UNTyLtFe16h8SRM5BU9hD","7VQXHJjFkfHJqPXoHWs9p41i1uSctkfhv4nR6vTb7cfU","AURMhKmTd1jKDLBnQN9NXUJg64U1Waez6qe1fYXT7H5X","FZXibGDEYcbFebKcUNkn2JmhUP7DuNMnNgrECLC9QFfN"],"type":"shared_funder","window":{"basis":"block_time","end":1738890350,"start":1738887704}}],"supply_share":0.3269,"supply_share_denominator":"analyzed_buyers_received_amount","wallets":["2rKnVjD73CZXxhzVCiBd5a6UNTyLtFe16h8SRM5BU9hD","FZXibGDEYcbFebKcUNkn2JmhUP7DuNMnNgrECLC9QFfN","AURMhKmTd1jKDLBnQN9NXUJg64U1Waez6qe1fYXT7H5X"]},{"cluster_id":"c-1e423002fd8f2009","confidence":0.7824,"evidence":[{"source":["3xde4qqU9PcKyjTs128jUpFFGcmFAt8hXyTDYtMk3XcM","5mi7cBa1stKPqHeYh4Yy62e1TP4okoPLkcv6FvqJH3yY","7cVN6NVFD5U9Xp9stJZmbRAXmMEZnFQVYarSU5Z5fxCw","CQzvCcJhpTi8oHJNCy3dQcHyjjS5gRshw4ocTsr5Np2H","EiZqWMYyrKKQQWuYdRxwoB3xt17Ho7m6aHCvUH2oa4nv","FdGt4ZKSWwjnUn2Hdz3FNmBbW5831XwdAPJLqeyjiziV"],"type":"same_amounts","window":{"basis":"slot","end":318969052,"start":318926536}},{"source":["3xde4qqU9PcKyjTs128jUpFFGcmFAt8hXyTDYtMk3XcM","5mi7cBa1stKPqHeYh4Yy62e1TP4okoPLkcv6FvqJH3yY","7cVN6NVFD5U9Xp9stJZmbRAXmMEZnFQVYarSU5Z5fxCw","EiZqWMYyrKKQQWuYdRxwoB3xt17Ho7m6aHCvUH2oa4nv","FdGt4ZKSWwjnUn2Hdz3FNmBbW5831XwdAPJLqeyjiziV"],"type":"same_amounts","window":{"basis":"slot","end":318971942,"start":318971942}},{"source":["3xde4qqU9PcKyjTs128jUpFFGcmFAt8hXyTDYtMk3XcM","5mi7cBa1stKPqHeYh4Yy62e1TP4okoPLkcv6FvqJH3yY","7cVN6NVFD5U9Xp9stJZmbRAXmMEZnFQVYarSU5Z5fxCw","CQzvCcJhpTi8oHJNCy3dQcHyjjS5gRshw4ocTsr5Np2H","EiZqWMYyrKKQQWuYdRxwoB3xt17Ho7m6aHCvUH2oa4nv","FdGt4ZKSWwjnUn2Hdz3FNmBbW5831XwdAPJLqeyjiziV"],"type":"same_slot","window":{"basis":"slot","end":318971942,"start":318971942}},{"source":["3xde4qqU9PcKyjTs128jUpFFGcmFAt8hXyTDYtMk3XcM","5mi7cBa1stKPqHeYh4Yy62e1TP4okoPLkcv6FvqJH3yY","7VQXHJjFkfHJqPXoHWs9p41i1uSctkfhv4nR6vTb7cfU","7cVN6NVFD5U9Xp9stJZmbRAXmMEZnFQVYarSU5Z5fxCw","CQzvCcJhpTi8oHJNCy3dQcHyjjS5gRshw4ocTsr5Np2H","EiZqWMYyrKKQQWuYdRxwoB3xt17Ho7m6aHCvUH2oa4nv","FdGt4ZKSWwjnUn2Hdz3FNmBbW5831XwdAPJLqeyjiziV"],"type":"shared_funder","window":{"basis":"block_time","end":1738873578,"start":1738873578}}],"supply_share":0.102,"supply_share_denominator":"analyzed_buyers_received_amount","wallets":["3xde4qqU9PcKyjTs128jUpFFGcmFAt8hXyTDYtMk3XcM","5mi7cBa1stKPqHeYh4Yy62e1TP4okoPLkcv6FvqJH3yY","7cVN6NVFD5U9Xp9stJZmbRAXmMEZnFQVYarSU5Z5fxCw","CQzvCcJhpTi8oHJNCy3dQcHyjjS5gRshw4ocTsr5Np2H","EiZqWMYyrKKQQWuYdRxwoB3xt17Ho7m6aHCvUH2oa4nv","FdGt4ZKSWwjnUn2Hdz3FNmBbW5831XwdAPJLqeyjiziV"]}],"coordination_category":"strong","error":null,"mint":"AKF3enKZKEpaQwwP3fU6ij3P5pj3VEpRXEuQ3NE5pump","provenance":{"address_lists_version":1,"analyzed_at":1791709470,"cluster_config_version":2,"completeness_reasons":["complete_data"],"graph_status":"complete","hub_config_version":3,"ingest_config_version":5},"risk_score":74,"wallets_analyzed":30}