{"analyzed_at":1791727928,"band":"high_concentration","band_reasons":["clusters_share_weighted"],"clusters":[{"cluster_id":"c-6d4e46a267363bce","confidence":0.776,"evidence":[{"source":["45aeXTdo3WzRufgKNWAYAVEYAQunryTZYTcmRPwqBjKn","6RvyevJn1u2hb2qvZ5DJ3Va4MgKYbhUkEdYANDqFfvU1","7R8Ap9omrsDodzNevRgq4Wh42BgpEPMUyPt6TQPiYGbn","CP4vZWivUM1azMXfgtZXPhdYvciZa5Xny5o2NfiagPjW","CiQWUb9PsU1BgezMCEnuSD8nutiSYb9Vhmje4QgnWg4m","Cw8pv3MiNjwPPcUff5dsMQTMSHJkebBMMNLLGb8cnc9K","Fd88R9dFTsmPcJLjZi67g8cKUUCq39CdSELqYWnCiAPk","FonySoFgRB4BtkzqUfVqj57tUSHBx95WL1kzTmrVcjBC","JCyKJ3CLLxf5ozY8fcni5qoSg6uia2CfiqU6uYfM8xqE"],"type":"indirect_link","window":{"basis":"block_time","end":1739732223,"start":1739731920}},{"source":["6RvyevJn1u2hb2qvZ5DJ3Va4MgKYbhUkEdYANDqFfvU1","CP4vZWivUM1azMXfgtZXPhdYvciZa5Xny5o2NfiagPjW","CiQWUb9PsU1BgezMCEnuSD8nutiSYb9Vhmje4QgnWg4m","Cw8pv3MiNjwPPcUff5dsMQTMSHJkebBMMNLLGb8cnc9K","Fd88R9dFTsmPcJLjZi67g8cKUUCq39CdSELqYWnCiAPk"],"type":"same_amounts","window":{"basis":"slot","end":321092308,"start":321092200}},{"source":["6RvyevJn1u2hb2qvZ5DJ3Va4MgKYbhUkEdYANDqFfvU1","CP4vZWivUM1azMXfgtZXPhdYvciZa5Xny5o2NfiagPjW","CiQWUb9PsU1BgezMCEnuSD8nutiSYb9Vhmje4QgnWg4m","Cw8pv3MiNjwPPcUff5dsMQTMSHJkebBMMNLLGb8cnc9K","Fd88R9dFTsmPcJLjZi67g8cKUUCq39CdSELqYWnCiAPk","JCyKJ3CLLxf5ozY8fcni5qoSg6uia2CfiqU6uYfM8xqE"],"type":"shared_funder","window":{"basis":"block_time","end":1739732108,"start":1739732065}}],"supply_share":0.9206,"supply_share_denominator":"analyzed_buyers_received_amount","wallets":["7R8Ap9omrsDodzNevRgq4Wh42BgpEPMUyPt6TQPiYGbn","Fd88R9dFTsmPcJLjZi67g8cKUUCq39CdSELqYWnCiAPk","CP4vZWivUM1azMXfgtZXPhdYvciZa5Xny5o2NfiagPjW","Cw8pv3MiNjwPPcUff5dsMQTMSHJkebBMMNLLGb8cnc9K","CiQWUb9PsU1BgezMCEnuSD8nutiSYb9Vhmje4QgnWg4m","6RvyevJn1u2hb2qvZ5DJ3Va4MgKYbhUkEdYANDqFfvU1"]},{"cluster_id":"c-04219b292ca3c9ed","confidence":0.9802,"evidence":[{"source":["22EbXLTtgcudUY76RzicMP5fHkkRPRtKVgKX8SRU8RkM","3nvtbEB8VYLTpMLkRP5tmZGMm9nN8fj7ZLXugXxjk7gC","5tzFkiKscXHK5ZXCGbXZxdw7gTjjD1mBwuoFbhUvuAi9","GeuwzbLRYDnXgqckqVMroEvs3UQ7oZWfXTwxkyyGxQTm"],"type":"indirect_link","window":{"basis":"block_time","end":1739727165,"start":1739727165}},{"source":["3nvtbEB8VYLTpMLkRP5tmZGMm9nN8fj7ZLXugXxjk7gC","4xpzEXNqPAW7V1Mo61w7etDHy84zitFVhTKoiU3dTXWD","5tzFkiKscXHK5ZXCGbXZxdw7gTjjD1mBwuoFbhUvuAi9","GeuwzbLRYDnXgqckqVMroEvs3UQ7oZWfXTwxkyyGxQTm"],"type":"indirect_link","window":{"basis":"block_time","end":1739727165,"start":1739727165}},{"source":["3nvtbEB8VYLTpMLkRP5tmZGMm9nN8fj7ZLXugXxjk7gC","52JZFyXhREuDJWKobX4kguMCJf9ZnSJcpAMPiEC88QzT","5tzFkiKscXHK5ZXCGbXZxdw7gTjjD1mBwuoFbhUvuAi9","GeuwzbLRYDnXgqckqVMroEvs3UQ7oZWfXTwxkyyGxQTm"],"type":"indirect_link","window":{"basis":"block_time","end":1739727165,"start":1739727165}},{"source":["3nvtbEB8VYLTpMLkRP5tmZGMm9nN8fj7ZLXugXxjk7gC","5MQHqa1o4EhakngVdY7BhBcJXescN6zW7pqW9GbREgMk","5tzFkiKscXHK5ZXCGbXZxdw7gTjjD1mBwuoFbhUvuAi9","GeuwzbLRYDnXgqckqVMroEvs3UQ7oZWfXTwxkyyGxQTm"],"type":"indirect_link","window":{"basis":"block_time","end":1739727165,"start":1739727165}},{"source":["3nvtbEB8VYLTpMLkRP5tmZGMm9nN8fj7ZLXugXxjk7gC","5tzFkiKscXHK5ZXCGbXZxdw7gTjjD1mBwuoFbhUvuAi9","6RQgaEm1vvbQvvQ1afe31CW6Np1wXnMu8RH9k7JFDsFF","GeuwzbLRYDnXgqckqVMroEvs3UQ7oZWfXTwxkyyGxQTm"],"type":"indirect_link","window":{"basis":"block_time","end":1739727165,"start":1739727165}},{"source":["3nvtbEB8VYLTpMLkRP5tmZGMm9nN8fj7ZLXugXxjk7gC","5tzFkiKscXHK5ZXCGbXZxdw7gTjjD1mBwuoFbhUvuAi9","6gFG5QqvHer1cqP3qvewQtswi48T7jLfmGZewVWFFFjW","GeuwzbLRYDnXgqckqVMroEvs3UQ7oZWfXTwxkyyGxQTm"],"type":"indirect_link","window":{"basis":"block_time","end":1739727165,"start":1739727165}},{"source":["3nvtbEB8VYLTpMLkRP5tmZGMm9nN8fj7ZLXugXxjk7gC","5tzFkiKscXHK5ZXCGbXZxdw7gTjjD1mBwuoFbhUvuAi9","BAoH6hwo7Q9HEodiLsedpvhg8868VXL1sGc4X98ZJzGM","GeuwzbLRYDnXgqckqVMroEvs3UQ7oZWfXTwxkyyGxQTm"],"type":"indirect_link","window":{"basis":"block_time","end":1739727164,"start":1739727164}},{"source":["3nvtbEB8VYLTpMLkRP5tmZGMm9nN8fj7ZLXugXxjk7gC","5tzFkiKscXHK5ZXCGbXZxdw7gTjjD1mBwuoFbhUvuAi9","EKZipDqZsrEZyM4YKns8SZBQXQchPH89uT6P33UNHLt3","GeuwzbLRYDnXgqckqVMroEvs3UQ7oZWfXTwxkyyGxQTm"],"type":"indirect_link","window":{"basis":"block_time","end":1739727165,"start":1739727165}},{"source":["3nvtbEB8VYLTpMLkRP5tmZGMm9nN8fj7ZLXugXxjk7gC","5tzFkiKscXHK5ZXCGbXZxdw7gTjjD1mBwuoFbhUvuAi9","EZGwwtUMXs4RaFToKZji22zNCA41G2WsqQSJ2repNbiW","GeuwzbLRYDnXgqckqVMroEvs3UQ7oZWfXTwxkyyGxQTm"],"type":"indirect_link","window":{"basis":"block_time","end":1739727165,"start":1739727165}},{"source":["3nvtbEB8VYLTpMLkRP5tmZGMm9nN8fj7ZLXugXxjk7gC","5tzFkiKscXHK5ZXCGbXZxdw7gTjjD1mBwuoFbhUvuAi9","FvXtJqobybvAv7D6piic5javjfE71gumCTua4oBvRexp","GeuwzbLRYDnXgqckqVMroEvs3UQ7oZWfXTwxkyyGxQTm"],"type":"indirect_link","window":{"basis":"block_time","end":1739727166,"start":1739727166}},{"source":["3nvtbEB8VYLTpMLkRP5tmZGMm9nN8fj7ZLXugXxjk7gC","5tzFkiKscXHK5ZXCGbXZxdw7gTjjD1mBwuoFbhUvuAi9","G3fjZG7UQfRgTepNc5huojpe3ua1LGUu9wypirBAJGiA","GeuwzbLRYDnXgqckqVMroEvs3UQ7oZWfXTwxkyyGxQTm"],"type":"indirect_link","window":{"basis":"block_time","end":1739727166,"start":1739727166}}],"supply_share":0.0029,"supply_share_denominator":"analyzed_buyers_received_amount","wallets":["GeuwzbLRYDnXgqckqVMroEvs3UQ7oZWfXTwxkyyGxQTm","3nvtbEB8VYLTpMLkRP5tmZGMm9nN8fj7ZLXugXxjk7gC"]}],"coordination_category":"strong","error":null,"mint":"GnQUsLcyZ3NXUAPXymWoefMYfCwmJazBVkko4vb7pump","provenance":{"address_lists_version":1,"analyzed_at":1791727928,"cluster_config_version":2,"completeness_reasons":["complete_data"],"graph_status":"complete","hub_config_version":3,"ingest_config_version":5},"risk_score":72,"wallets_analyzed":30}