{"analyzed_at":1791709385,"band":"high_concentration","band_reasons":["clusters_share_weighted"],"clusters":[{"cluster_id":"c-0212f68e7012dc9f","confidence":0.9999,"evidence":[{"source":["6n1URhJLVZ47r4pLZDWmWzWivzoiezMgNkYd1sPcaVcR","GWtGzNhrW2hqSDhP2K3VnGYXPvCgMPJi1TaA5iTcAmud"],"type":"direct_transfer","window":{"basis":"block_time","end":1736526141,"start":1736525998}},{"source":["Ae4uRhSjWTkMXWqc27FK1j7vA458Ahfw9KhRC3WpPRAj","GWtGzNhrW2hqSDhP2K3VnGYXPvCgMPJi1TaA5iTcAmud"],"type":"direct_transfer","window":{"basis":"block_time","end":1736525998,"start":1736525998}},{"source":["BB8GUfBb9X9VGCWingrejqUn29MmNu74K44gJF4Mcu6x","GWtGzNhrW2hqSDhP2K3VnGYXPvCgMPJi1TaA5iTcAmud"],"type":"direct_transfer","window":{"basis":"block_time","end":1736526166,"start":1736525998}},{"source":["BRQ2qUntb4DXqoQmFDGV1S7MhZwwvG7phCU5mMQeXwbw","GWtGzNhrW2hqSDhP2K3VnGYXPvCgMPJi1TaA5iTcAmud"],"type":"direct_transfer","window":{"basis":"block_time","end":1736526000,"start":1736526000}},{"source":["BdFNUVYVdpuwpnX2GqeAogGrM4ZXqqviDvy4dcqMT5N4","GWtGzNhrW2hqSDhP2K3VnGYXPvCgMPJi1TaA5iTcAmud"],"type":"direct_transfer","window":{"basis":"block_time","end":1736526000,"start":1736526000}},{"source":["DYjC8i2Sz6VdkbTXZGas3iCKsraEYaCpEDZdXPs76mVN","GWtGzNhrW2hqSDhP2K3VnGYXPvCgMPJi1TaA5iTcAmud"],"type":"direct_transfer","window":{"basis":"block_time","end":1736526115,"start":1736525998}},{"source":["FxceUXQA2FUvEwTggsKq7aJE3a64EUETbK6eQqQdkSuG","GWtGzNhrW2hqSDhP2K3VnGYXPvCgMPJi1TaA5iTcAmud"],"type":"direct_transfer","window":{"basis":"block_time","end":1736525998,"start":1736525998}},{"source":["GWtGzNhrW2hqSDhP2K3VnGYXPvCgMPJi1TaA5iTcAmud","GgUFWFPHeaiiijAHKPpDfk8B3rhczrhdwVAZwNoNeBvS"],"type":"direct_transfer","window":{"basis":"block_time","end":1736526115,"start":1736525998}},{"source":["GWtGzNhrW2hqSDhP2K3VnGYXPvCgMPJi1TaA5iTcAmud","mKFFLQqRjCXPwmrWY16pMnzxzSBERqtjn1ZgdLQb1w5"],"type":"direct_transfer","window":{"basis":"block_time","end":1736525998,"start":1736525998}},{"source":["GWtGzNhrW2hqSDhP2K3VnGYXPvCgMPJi1TaA5iTcAmud","qo749K8t3FWECtniwXXPABiokDkarxrpmVPEZSsmEvN"],"type":"direct_transfer","window":{"basis":"block_time","end":1736526115,"start":1736525998}},{"source":["6n1URhJLVZ47r4pLZDWmWzWivzoiezMgNkYd1sPcaVcR","Ae4uRhSjWTkMXWqc27FK1j7vA458Ahfw9KhRC3WpPRAj","BB8GUfBb9X9VGCWingrejqUn29MmNu74K44gJF4Mcu6x","BRQ2qUntb4DXqoQmFDGV1S7MhZwwvG7phCU5mMQeXwbw","BdFNUVYVdpuwpnX2GqeAogGrM4ZXqqviDvy4dcqMT5N4","DYjC8i2Sz6VdkbTXZGas3iCKsraEYaCpEDZdXPs76mVN","FxceUXQA2FUvEwTggsKq7aJE3a64EUETbK6eQqQdkSuG","GgUFWFPHeaiiijAHKPpDfk8B3rhczrhdwVAZwNoNeBvS","mKFFLQqRjCXPwmrWY16pMnzxzSBERqtjn1ZgdLQb1w5","qo749K8t3FWECtniwXXPABiokDkarxrpmVPEZSsmEvN"],"type":"same_amounts","window":{"basis":"slot","end":313122269,"start":313104343}},{"source":["6Dpe2Y8wSeEKRFoS4o66rWPQMBndEMwatFeC3BgGUuUu","6n1URhJLVZ47r4pLZDWmWzWivzoiezMgNkYd1sPcaVcR","Ae4uRhSjWTkMXWqc27FK1j7vA458Ahfw9KhRC3WpPRAj","BRQ2qUntb4DXqoQmFDGV1S7MhZwwvG7phCU5mMQeXwbw","BdFNUVYVdpuwpnX2GqeAogGrM4ZXqqviDvy4dcqMT5N4","DYjC8i2Sz6VdkbTXZGas3iCKsraEYaCpEDZdXPs76mVN","FxceUXQA2FUvEwTggsKq7aJE3a64EUETbK6eQqQdkSuG","GgUFWFPHeaiiijAHKPpDfk8B3rhczrhdwVAZwNoNeBvS","mKFFLQqRjCXPwmrWY16pMnzxzSBERqtjn1ZgdLQb1w5","qo749K8t3FWECtniwXXPABiokDkarxrpmVPEZSsmEvN"],"type":"shared_funder","window":{"basis":"block_time","end":1736520977,"start":1736520976}},{"source":["Ae4uRhSjWTkMXWqc27FK1j7vA458Ahfw9KhRC3WpPRAj","Apc6sUo2eaETJFd52JS7zvZuQFRCqgkydznrmtaN6G5K","BRQ2qUntb4DXqoQmFDGV1S7MhZwwvG7phCU5mMQeXwbw","BdFNUVYVdpuwpnX2GqeAogGrM4ZXqqviDvy4dcqMT5N4","DYjC8i2Sz6VdkbTXZGas3iCKsraEYaCpEDZdXPs76mVN","FxceUXQA2FUvEwTggsKq7aJE3a64EUETbK6eQqQdkSuG","GgUFWFPHeaiiijAHKPpDfk8B3rhczrhdwVAZwNoNeBvS","mKFFLQqRjCXPwmrWY16pMnzxzSBERqtjn1ZgdLQb1w5"],"type":"shared_funder","window":{"basis":"block_time","end":1736518725,"start":1736518722}},{"source":["6n1URhJLVZ47r4pLZDWmWzWivzoiezMgNkYd1sPcaVcR","Ae4uRhSjWTkMXWqc27FK1j7vA458Ahfw9KhRC3WpPRAj","BRQ2qUntb4DXqoQmFDGV1S7MhZwwvG7phCU5mMQeXwbw","BdFNUVYVdpuwpnX2GqeAogGrM4ZXqqviDvy4dcqMT5N4","DYjC8i2Sz6VdkbTXZGas3iCKsraEYaCpEDZdXPs76mVN","ESpedNfhVMfyY4aMkFBA4FHhGBeJCMDrQXtMBVRFxdT1","FxceUXQA2FUvEwTggsKq7aJE3a64EUETbK6eQqQdkSuG","GgUFWFPHeaiiijAHKPpDfk8B3rhczrhdwVAZwNoNeBvS","mKFFLQqRjCXPwmrWY16pMnzxzSBERqtjn1ZgdLQb1w5","qo749K8t3FWECtniwXXPABiokDkarxrpmVPEZSsmEvN"],"type":"shared_funder","window":{"basis":"block_time","end":1736519716,"start":1736519714}},{"source":["6n1URhJLVZ47r4pLZDWmWzWivzoiezMgNkYd1sPcaVcR","Ae4uRhSjWTkMXWqc27FK1j7vA458Ahfw9KhRC3WpPRAj","BB8GUfBb9X9VGCWingrejqUn29MmNu74K44gJF4Mcu6x","BRQ2qUntb4DXqoQmFDGV1S7MhZwwvG7phCU5mMQeXwbw","BdFNUVYVdpuwpnX2GqeAogGrM4ZXqqviDvy4dcqMT5N4","DYjC8i2Sz6VdkbTXZGas3iCKsraEYaCpEDZdXPs76mVN","F5XYgrdUr3T9Sxat2WbDfZr9Y1QhGdtN9ET7gDbV4oyj","FxceUXQA2FUvEwTggsKq7aJE3a64EUETbK6eQqQdkSuG","GWtGzNhrW2hqSDhP2K3VnGYXPvCgMPJi1TaA5iTcAmud","GgUFWFPHeaiiijAHKPpDfk8B3rhczrhdwVAZwNoNeBvS","mKFFLQqRjCXPwmrWY16pMnzxzSBERqtjn1ZgdLQb1w5","qo749K8t3FWECtniwXXPABiokDkarxrpmVPEZSsmEvN"],"type":"shared_funder","window":{"basis":"block_time","end":1736525882,"start":1736522375}}],"supply_share":0.7942,"supply_share_denominator":"analyzed_buyers_received_amount","wallets":["GWtGzNhrW2hqSDhP2K3VnGYXPvCgMPJi1TaA5iTcAmud","6n1URhJLVZ47r4pLZDWmWzWivzoiezMgNkYd1sPcaVcR","BB8GUfBb9X9VGCWingrejqUn29MmNu74K44gJF4Mcu6x","qo749K8t3FWECtniwXXPABiokDkarxrpmVPEZSsmEvN","GgUFWFPHeaiiijAHKPpDfk8B3rhczrhdwVAZwNoNeBvS","DYjC8i2Sz6VdkbTXZGas3iCKsraEYaCpEDZdXPs76mVN","Ae4uRhSjWTkMXWqc27FK1j7vA458Ahfw9KhRC3WpPRAj","FxceUXQA2FUvEwTggsKq7aJE3a64EUETbK6eQqQdkSuG","BRQ2qUntb4DXqoQmFDGV1S7MhZwwvG7phCU5mMQeXwbw","mKFFLQqRjCXPwmrWY16pMnzxzSBERqtjn1ZgdLQb1w5","BdFNUVYVdpuwpnX2GqeAogGrM4ZXqqviDvy4dcqMT5N4"]},{"cluster_id":"c-90afb325ef41f361","confidence":0.5,"evidence":[{"source":["6XexrF8H1mNvmjio7a7QzfnAjafQtGRGhACeYRuKqBho","CYgeFLqaDof2EuzvV3zApD7x1jECJXTF6Jziv9qMzcFV"],"type":"direct_transfer","window":{"basis":"block_time","end":1736519683,"start":1736519683}}],"supply_share":0.0049,"supply_share_denominator":"analyzed_buyers_received_amount","wallets":["CYgeFLqaDof2EuzvV3zApD7x1jECJXTF6Jziv9qMzcFV","6XexrF8H1mNvmjio7a7QzfnAjafQtGRGhACeYRuKqBho"]}],"coordination_category":"strong","error":null,"mint":"4vsZT8joYzyiEYFcToJ4ZVsx9bmxvQNApNAD1ecmpump","provenance":{"address_lists_version":1,"analyzed_at":1791709385,"cluster_config_version":2,"completeness_reasons":["complete_data"],"graph_status":"complete","hub_config_version":3,"ingest_config_version":5},"risk_score":80,"wallets_analyzed":30}